{
  "$schema": "http://json-schema.org/draft-07/schema#",
  "description": "Provides the ability to appoint a reporting company for the group",
  "type": "object",
  "properties": {
    "agentDetails": {
      "description": "Details of the agent where an agent is submitting on behalf of the reporting company",
      "$ref": "subSchemas/agentDetails.json"
    },
    "reportingCompany": {
      "$ref": "subSchemas/reportingCompany.json"
    },
    "authorisingCompanies": {
      "description": "Details of companies authorising the appointment",
      "$ref": "subSchemas/authorisingCompanies.json"
    },
    "isReportingCompanyAppointingItself": {
      "description": "Indicate whether the reporting company is appointing itself",
      "type": "boolean"
    },
    "identityOfAppointingCompany": {
      "description": "Details of the company appointing the reporting company",
      "$ref": "subSchemas/identityOfCompanySubmitting.json"
    },
    "ultimateParentCompany": {
      "$ref": "subSchemas/ultimateParent.json"
    },
    "accountingPeriod" : {
      "description": "The worldwide group's period of account",
      "$ref": "subSchemas/accountingPeriod.json"
    },
    "declaration": {
      "description": "Statement to confirm the truth of the information given and that the authorising companies listed make up at least 50% of eligible companies in the group",
      "$ref": "definitions/definitions.json#/definitions/declaration"
    }
  },
  "required": [
    "agentDetails",
    "authorisingCompanies",
    "reportingCompany",
    "isReportingCompanyAppointingItself",
    "accountingPeriod",
    "declaration"
  ],
  "additionalProperties": false
}