{
  "agentDetails": {
    "agentActingOnBehalfOfCompany": true,
    "agentName": "AAgent"
  },
  "reportingCompany": {
    "companyName": "ACompany",
    "ctutr": "1123456789",

    "sameAsUltimateParent": true
  },
  "isReportingCompanyAppointingItself":false,
  "identityOfAppointingCompany": {
    "companyName": "BCompany",
    "ctutr": "9999999999"
  },
  "authorisingCompanies": [{
    "companyName": "CCompany",
    "ctutr": "5555555555"
  }],
  "accountingPeriod": {
    "startDate": "2018-11-01",
    "endDate": "2019-12-01"
  },
  "declaration": true
}